{
 "format": "kugiri-timeline",
 "version": 1,
 "language": "ja",
 "fps": 30.0,
 "cues": [
  {
   "start": 0.0,
   "end": 4.2,
   "text": "はいどうもこんにちは今日は新しいマイクを試してみたいと思います",
   "lines": [
    "はいどうもこんにちは今日は新しい",
    "マイクを試してみたいと思います"
   ],
   "ruby": [
    {
     "cs": 10,
     "ce": 12,
     "text": "きょう"
    },
    {
     "cs": 13,
     "ce": 14,
     "text": "あたら"
    },
    {
     "cs": 20,
     "ce": 21,
     "text": "ため"
    },
    {
     "cs": 27,
     "ce": 28,
     "text": "おも"
    }
   ],
   "speaker": "進行"
  },
  {
   "start": 4.267,
   "end": 5.533,
   "text": "よろしくお願いします",
   "lines": [
    "よろしくお願いします"
   ],
   "ruby": [
    {
     "cs": 5,
     "ce": 6,
     "text": "ねが"
    }
   ],
   "speaker": "進行"
  },
  {
   "start": 5.6,
   "end": 7.433,
   "text": "まずは音を聞いてみましょうかなんか",
   "lines": [
    "まずは音を",
    "聞いてみましょうかなんか"
   ],
   "ruby": [
    {
     "cs": 3,
     "ce": 4,
     "text": "おと"
    },
    {
     "cs": 5,
     "ce": 6,
     "text": "き"
    }
   ],
   "speaker": "進行"
  },
  {
   "start": 7.5,
   "end": 10.167,
   "text": "ちょっとこもってる感じがしますね",
   "lines": [
    "ちょっとこもってる感じがしますね"
   ],
   "ruby": [
    {
     "cs": 9,
     "ce": 10,
     "text": "かん"
    }
   ],
   "speaker": "進行"
  },
  {
   "start": 12.5,
   "end": 13.2,
   "text": "そうかな",
   "lines": [
    "そうかな"
   ],
   "speaker": "ゲスト"
  },
  {
   "start": 13.267,
   "end": 14.267,
   "text": "僕は好きだよ",
   "lines": [
    "僕は好きだよ"
   ],
   "ruby": [
    {
     "cs": 0,
     "ce": 1,
     "text": "ぼく"
    },
    {
     "cs": 2,
     "ce": 3,
     "text": "す"
    }
   ],
   "speaker": "ゲスト"
  }
 ]
}
